{
  "schemaVersion": "1.0",
  "gameId": "sate-match",
  "concept": {
    "status": "approved",
    "revision": 1,
    "approvedAt": "2026-01-01T00:00:00Z",
    "evidence": "TEST FIXTURE ONLY - not real user approval"
  },
  "artDirection": {
    "status": "approved",
    "revision": 1,
    "approvedAt": "2026-01-01T00:00:00Z",
    "evidence": "TEST FIXTURE ONLY - not real user approval"
  }
}
